{
  "$id": "EsAhmFShdnoXHBQywsLdxup7Rq8_eSd-B1huca-fF-ps",
  "$schema": "http://json-schema.org/draft-07/schema#",
  "properties": {
    "credentialStatus": {
      "properties": {
        "id": {
          "type": "string"
        },
        "type": {
          "type": "string"
        }
      },
      "required": [
        "id"
      ],
      "type": "object"
    },
    "credentialSubject": {
      "properties": {
        "LEI": {
          "type": "string"
        },
        "engagementRoleContext": {
          "type": "string"
        },
        "personLegalName": {
          "type": "string"
        },
        "qualifiedvLEIIssuervLEICredential": {
          "type": "string"
        }
      },
      "additionalProperties": false,
      "required": [
        "LEI",
        "personLegalName",
        "engagementRoleContext",
        "qualifiedvLEIIssuervLEICredential"
      ],
      "type": "object"
    },
    "issuanceDate": {
      "format": "date-time",
      "type": "string"
    },
    "issuer": {
      "type": "string"
    },
    "type": {
      "contains": {
        "const": "LegalEntityEngagementContextRolevLEICredential"
      },
      "type": "array"
    }
  },
  "required": [
    "type",
    "issuer",
    "issuanceDate",
    "credentialSubject",
    "credentialStatus"
  ],
  "type": "object"
}