{
  "credentialSubject": {
    "LEI": "254900OPPU84GM83MG36",
    "personLegalName": "Karla McKenna",
    "engagementRoleContext": "Head of Standards",
    "qualifiedvLEIIssuervLEICredential": "EYdjd3TMjapXptVvyXARrsfpOtaIaY4HuvaHHkgVSvW"
  },
  "issuer": "EGtyThM1rLBSMZ_ozM1uAnFvSfC0N1jaQ42aKU5sHYTGFD",
  "credentialStatus": {
    "id": "did:keri:EymRy7xMwsxUelUauaXtMxTfPAMPAI6FkekwlOjkggt"
  },
  "issuanceDate": "2019-05-23T04:00:00.0Z",
  "type": [
    "VerifiablePresentation",
    "LegalEntityEngagementContextRolevLEICredential"
  ]
}
